{
  "schema_version": "1.0",
  "message_id": "01JQ7PK0P3R7V5BT7P0Q9YQ8A1",
  "device_id": "esp32-sala-01",
  "site_id": "campus-ufg-bloco-inf",
  "sent_at": "2026-07-27T14:20:00Z",
  "sequence": 428,
  "measurements": {
    "co2_ppm": 450,
    "tvoc_ppb": 100,
    "pm1_ugm3": 8.4,
    "pm25_ugm3": 15.0,
    "pm10_ugm3": 20.0,
    "temperature_c": 24.5,
    "humidity_pct": 50.0
  },
  "quality": {
    "gas_status": "SAFE",
    "sensor_status": "OK"
  },
  "metadata": {
    "firmware_version": "1.0.0",
    "rssi_dbm": -62
  }
}
